<?xml version="1.0" encoding="UTF-8"?>
<!--
    Copyright 2016 NovaTec Consulting GmbH
   
    Licensed under the Apache License, Version 2.0 (the "License");
    you may not use this file except in compliance with the License.
    You may obtain a copy of the License at
   
        http://www.apache.org/licenses/LICENSE-2.0
   
    Unless required by applicable law or agreed to in writing, software
    distributed under the License is distributed on an "AS IS" BASIS,
    WITHOUT WARRANTIES OR CONDITIONS OF ANY KIND, either express or implied.
    See the License for the specific language governing permissions and
    limitations under the License.
 -->

<sc:stereotypes
	xmlns:sc="http://www.novatec-gmbh.de/checkstyle-stereotype-override"
	xmlns:xsi="http://www.w3.org/2001/XMLSchema-instance"
	xsi:schemaLocation="http://www.novatec-gmbh.de/checkstyle-stereotype-override checkstyle-stereotype-override.xsd ">

	<stereotype id="businessservice">
		<interface
			name="info.novatec.architecture.check.testclasses.core.fwk.api.bl.bs.ApiBusinessService"
			condition="sufficient" overridemode="extend" />
	</stereotype>

	<stereotype id="businessservice2">
		<interface condition="sufficient" overridemode="extend">
			<interfacename
				name="info.novatec.architecture.check.testclasses.core.fwk.api.bl.bs.ApiBusinessService2" />
		</interface>
	</stereotype>

	<stereotype id="entity">
		<baseclass condition="sufficient" overridemode="extend">
			<baseclassname
				name="info.novatec.architecture.check.testclasses.app1.main.data.entity.common.BaseEntity" />
			<baseclassname
				name="info.novatec.architecture.check.testclasses.app1.main.data.entity.CustomerConcern" />
		</baseclass>
	</stereotype>

	<stereotype id="entity2">
		<baseclass
			name="info.novatec.architecture.check.testclasses.app1.main.data.entity.common.BaseEntity2"
			condition="sufficient" overridemode="extend" />
	</stereotype>

</sc:stereotypes>